{
  "version": "0.1.0",
  "audio": {
    "path": "../../../examples/fixtures/example-song.wav",
    "durationSec": 8.0
  },
  "timing": {
    "offsetSec": 0.0
  },
  "playfield": {
    "laneCount": 5,
    "profile": "generic"
  },
  "notes": [
    {
      "id": "n-0001",
      "type": "tap",
      "timeSec": 0.0,
      "lane": 2
    }
  ]
}
